{
  "schema_version": "pam-bootstrap/0.1.0",
  "source": {
    "repository": "Pukujan/project-assurance-modules",
    "remote": "https://github.com/Pukujan/project-assurance-modules.git",
    "requested_revision": {
      "kind": "git_commit",
      "value": "31d0b36f290460aaa3bb9dfd07e6833560516fcb"
    },
    "resolved_commit": "31d0b36f290460aaa3bb9dfd07e6833560516fcb"
  },
  "acquisition": {
    "mechanism": "git_fetch_exact_revision",
    "fetch_scope": "single_revision",
    "checkout_mode": "detached"
  },
  "verification": {
    "required": true,
    "method": "git_rev_parse_head",
    "expected_commit": "31d0b36f290460aaa3bb9dfd07e6833560516fcb",
    "fail_on_mismatch": true
  },
  "start": {
    "kind": "document",
    "locator": "AGENTS.md",
    "must_exist_before_routing": true
  },
  "content_identity": {
    "authoritative_basis": "git_object_id",
    "working_tree_bytes_authoritative": false,
    "line_ending_normalization_authoritative": false,
    "note": "Use Git commit/tree/blob identity or an explicit content digest for benchmark and contract identity; do not compare platform-transformed working-tree bytes as the primary identity."
  },
  "failure_behavior": {
    "acquisition_unavailable": "stop_before_routing",
    "revision_unavailable": "stop_before_routing",
    "revision_mismatch": "stop_before_routing",
    "start_missing": "stop_before_routing"
  }
}
